Survived,Fare,No_of_relatives_on_board,Age,PassengerClass,No_of_siblings_plus_spouses_on_board,No_of_parents_plus_children_on_board,Sex_female,Sex_male,Sex_nan,Deck_A,Deck_B,Deck_C,Deck_D,Deck_E,Deck_F,Deck_G,Deck_T,Deck_Unkown,Embarked_Cherbourg,Embarked_Queenstown,Embarked_Southamption,Embarked_Unknown,Name
0,7.25,1,22.0,3,1,0,0,1,0,0,0,0,0,0,0,0,0,1,0,0,1,0,"Braund, Mr. Owen Harris"
1,7.925,0,26.0,3,0,0,1,0,0,0,0,0,0,0,0,0,0,1,0,0,1,0,"Heikkinen, Miss. Laina"
0,8.05,0,35.0,3,0,0,0,1,0,0,0,0,0,0,0,0,0,1,0,0,1,0,"Allen, Mr. William Henry"
0,8.4583,0,-999.0,3,0,0,0,1,0,0,0,0,0,0,0,0,0,1,0,1,0,0,"Moran, Mr. James"
0,51.8625,0,54.0,1,0,0,0,1,0,0,0,0,0,1,0,0,0,0,0,0,1,0,"McCarthy, Mr. Timothy J"
1,16.7,2,4.0,3,1,1,1,0,0,0,0,0,0,0,0,1,0,0,0,0,1,0,"Sandstrom, Miss. Marguerite Rut"
1,26.55,0,58.0,1,0,0,1,0,0,0,0,1,0,0,0,0,0,0,0,0,1,0,"Bonnell, Miss. Elizabeth"
0,31.275,6,39.0,3,1,5,0,1,0,0,0,0,0,0,0,0,0,1,0,0,1,0,"Andersson, Mr. Anders Johan"
1,16.0,0,55.0,2,0,0,1,0,0,0,0,0,0,0,0,0,0,1,0,0,1,0,"Hewlett, Mrs. (Mary D Kingcome) "
0,29.125,5,2.0,3,4,1,0,1,0,0,0,0,0,0,0,0,0,1,0,1,0,0,"Rice, Master. Eugene"
1,13.0,0,-999.0,2,0,0,0,1,0,0,0,0,0,0,0,0,0,1,0,0,1,0,"Williams, Mr. Charles Eugene"
0,18.0,1,31.0,3,1,0,1,0,0,0,0,0,0,0,0,0,0,1,0,0,1,0,"Vander Planke, Mrs. Julius (Emelia Maria Vandemoortele)"
1,7.225,0,-999.0,3,0,0,1,0,0,0,0,0,0,0,0,0,0,1,1,0,0,0,"Masselmani, Mrs. Fatima"
0,26.0,0,35.0,2,0,0,0,1,0,0,0,0,0,0,0,0,0,1,0,0,1,0,"Fynney, Mr. Joseph J"
1,13.0,0,34.0,2,0,0,0,1,0,0,0,0,1,0,0,0,0,0,0,0,1,0,"Beesley, Mr. Lawrence"
1,8.0292,0,15.0,3,0,0,1,0,0,0,0,0,0,0,0,0,0,1,0,1,0,0,"McGowan, Miss. Anna ""Annie"""
1,35.5,0,28.0,1,0,0,0,1,0,1,0,0,0,0,0,0,0,0,0,0,1,0,"Sloper, Mr. William Thompson"
0,21.075,4,8.0,3,3,1,1,0,0,0,0,0,0,0,0,0,0,1,0,0,1,0,"Palsson, Miss. Torborg Danira"
0,7.225,0,-999.0,3,0,0,0,1,0,0,0,0,0,0,0,0,0,1,1,0,0,0,"Emir, Mr. Farred Chehab"
0,263.0,5,19.0,1,3,2,0,1,0,0,0,1,0,0,0,0,0,0,0,0,1,0,"Fortune, Mr. Charles Alexander"
1,7.8792,0,-999.0,3,0,0,1,0,0,0,0,0,0,0,0,0,0,1,0,1,0,0,"O'Dwyer, Miss. Ellen ""Nellie"""
0,7.8958,0,-999.0,3,0,0,0,1,0,0,0,0,0,0,0,0,0,1,0,0,1,0,"Todoroff, Mr. Lalio"
0,27.7208,0,40.0,1,0,0,0,1,0,0,0,0,0,0,0,0,0,1,1,0,0,0,"Uruchurtu, Don. Manuel E"
1,146.5208,1,-999.0,1,1,0,1,0,0,0,1,0,0,0,0,0,0,0,1,0,0,0,"Spencer, Mrs. William Augustus (Marie Eugenie)"
0,10.5,0,66.0,2,0,0,0,1,0,0,0,0,0,0,0,0,0,1,0,0,1,0,"Wheadon, Mr. Edward H"
0,52.0,1,42.0,1,1,0,0,1,0,0,0,0,0,0,0,0,0,1,0,0,1,0,"Holverson, Mr. Alexander Oskar"
1,7.2292,0,-999.0,3,0,0,0,1,0,0,0,0,0,0,0,0,0,1,1,0,0,0,"Mamee, Mr. Hanna"
0,8.05,0,21.0,3,0,0,0,1,0,0,0,0,0,0,0,0,0,1,0,0,1,0,"Cann, Mr. Ernest Charles"
0,18.0,2,18.0,3,2,0,1,0,0,0,0,0,0,0,0,0,0,1,0,0,1,0,"Vander Planke, Miss. Augusta Maria"
1,11.2417,1,14.0,3,1,0,1,0,0,0,0,0,0,0,0,0,0,1,1,0,0,0,"Nicola-Yarred, Miss. Jamila"
0,9.475,1,40.0,3,1,0,1,0,0,0,0,0,0,0,0,0,0,1,0,0,1,0,"Ahlin, Mrs. Johan (Johanna Persdotter Larsson)"
0,21.0,1,27.0,2,1,0,1,0,0,0,0,0,0,0,0,0,0,1,0,0,1,0,"Turpin, Mrs. William John Robert (Dorothy Ann Wonnacott)"
1,41.5792,3,3.0,2,1,2,1,0,0,0,0,0,0,0,0,0,0,1,1,0,0,0,"Laroche, Miss. Simonne Marie Anne Andree"
0,8.05,0,-999.0,3,0,0,0,1,0,0,0,0,0,0,0,0,0,1,0,0,1,0,"Rogers, Mr. William John"
0,15.5,1,-999.0,3,1,0,0,1,0,0,0,0,0,0,0,0,0,1,0,1,0,0,"Lennon, Mr. Denis"
1,7.75,0,-999.0,3,0,0,1,0,0,0,0,0,0,0,0,0,0,1,0,1,0,0,"O'Driscoll, Miss. Bridget"
0,21.6792,2,-999.0,3,2,0,0,1,0,0,0,0,0,0,0,0,0,1,1,0,0,0,"Samaan, Mr. Youssef"
0,39.6875,5,7.0,3,4,1,0,1,0,0,0,0,0,0,0,0,0,1,0,0,1,0,"Panula, Master. Juha Niilo"
0,7.8,0,21.0,3,0,0,0,1,0,0,0,0,0,0,0,0,0,1,0,0,1,0,"Nosworthy, Mr. Richard Cater"
1,76.7292,1,49.0,1,1,0,1,0,0,0,0,0,1,0,0,0,0,0,1,0,0,0,"Harper, Mrs. Henry Sleeper (Myna Haxtun)"
1,26.0,1,29.0,2,1,0,1,0,0,0,0,0,0,0,0,0,0,1,0,0,1,0,"Faunthorpe, Mrs. Lizzie (Elizabeth Anne Wilkinson)"
0,61.9792,1,65.0,1,0,1,0,1,0,0,1,0,0,0,0,0,0,0,1,0,0,0,"Ostby, Mr. Engelhart Cornelius"
1,35.5,0,-999.0,1,0,0,0,1,0,0,0,1,0,0,0,0,0,0,0,0,1,0,"Woolner, Mr. Hugh"
0,7.2292,0,28.5,3,0,0,0,1,0,0,0,0,0,0,0,0,0,1,1,0,0,0,"Novel, Mr. Mansouer"
1,27.75,3,5.0,2,1,2,1,0,0,0,0,0,0,0,0,0,0,1,0,0,1,0,"West, Miss. Constance Mirium"
0,46.9,7,11.0,3,5,2,0,1,0,0,0,0,0,0,0,0,0,1,0,0,1,0,"Goodwin, Master. William Frederick"
0,7.2292,0,22.0,3,0,0,0,1,0,0,0,0,0,0,0,0,0,1,1,0,0,0,"Sirayanian, Mr. Orsen"
1,80.0,0,38.0,1,0,0,1,0,0,0,1,0,0,0,0,0,0,0,0,0,0,1,"Icard, Miss. Amelie"
0,27.7208,0,-999.0,1,0,0,0,1,0,0,0,0,0,0,0,0,0,1,1,0,0,0,"Stewart, Mr. Albert A"
1,15.2458,2,-999.0,3,1,1,0,1,0,0,0,0,0,0,0,0,0,1,1,0,0,0,"Moubarek, Master. Gerios"
1,10.5,0,29.0,2,0,0,1,0,0,0,0,0,0,0,1,0,0,0,0,0,1,0,"Nye, Mrs. (Elizabeth Ramell)"
0,8.1583,0,19.0,3,0,0,0,1,0,0,0,0,0,0,0,0,0,1,0,0,1,0,"Crease, Mr. Ernest James"
1,7.925,6,17.0,3,4,2,1,0,0,0,0,0,0,0,0,0,0,1,0,0,1,0,"Andersson, Miss. Erna Alexandra"
0,10.5,0,32.0,2,0,0,0,1,0,0,0,0,0,0,0,0,0,1,0,0,1,0,"Jenkin, Mr. Stephen Curnow"
0,46.9,7,16.0,3,5,2,1,0,0,0,0,0,0,0,0,0,0,1,0,0,1,0,"Goodwin, Miss. Lillian Amy"
0,14.4542,1,26.0,3,1,0,0,1,0,0,0,0,0,0,0,0,0,1,1,0,0,0,"Chronopoulos, Mr. Apostolos"
1,56.4958,0,32.0,3,0,0,0,1,0,0,0,0,0,0,0,0,0,1,0,0,1,0,"Bing, Mr. Lee"
0,7.65,0,25.0,3,0,0,0,1,0,0,0,0,0,0,1,0,0,0,0,0,1,0,"Moen, Mr. Sigurd Hansen"
0,7.8958,0,-999.0,3,0,0,0,1,0,0,0,0,0,0,0,0,0,1,0,0,1,0,"Staneff, Mr. Ivan"
0,8.05,0,-999.0,3,0,0,0,1,0,0,0,0,0,0,0,0,0,1,0,0,1,0,"Moutal, Mr. Rahamin Haim"
1,29.0,2,0.83,2,0,2,0,1,0,0,0,0,0,0,0,0,0,1,0,0,1,0,"Caldwell, Master. Alden Gates"
1,12.475,0,30.0,3,0,0,1,0,0,0,0,0,0,0,0,0,0,1,0,0,1,0,"Dowdell, Miss. Elizabeth"
0,9.0,0,22.0,3,0,0,0,1,0,0,0,0,0,0,0,0,0,1,0,0,1,0,"Waelens, Mr. Achille"
1,9.5,0,29.0,3,0,0,0,1,0,0,0,0,0,0,0,0,0,1,0,0,1,0,"Sheerlinck, Mr. Jan Baptist"
1,7.7875,0,-999.0,3,0,0,1,0,0,0,0,0,0,0,0,0,0,1,0,1,0,0,"McDermott, Miss. Brigdet Delia"
0,47.1,0,28.0,1,0,0,0,1,0,0,0,0,0,0,0,0,0,1,0,0,1,0,"Carrau, Mr. Francisco M"
1,15.85,3,33.0,3,3,0,1,0,0,0,0,0,0,0,0,0,0,1,0,0,1,0,"Backstrom, Mrs. Karl Alfred (Maria Mathilda Gustafsson)"
0,8.05,0,-999.0,3,0,0,0,1,0,0,0,0,0,0,0,0,0,1,0,0,1,0,"Slocovski, Mr. Selman Francis"
1,263.0,5,23.0,1,3,2,1,0,0,0,0,1,0,0,0,0,0,0,0,0,1,0,"Fortune, Miss. Mabel Helen"
0,8.05,0,24.0,3,0,0,0,1,0,0,0,0,0,0,0,0,0,1,0,0,1,0,"Celotti, Mr. Francesco"
0,20.575,3,26.0,3,1,2,0,1,0,0,0,0,0,0,0,0,0,1,0,0,1,0,"Dean, Mr. Bertram Frank"
0,7.25,0,59.0,3,0,0,0,1,0,0,0,0,0,0,0,0,0,1,0,0,1,0,"Coxon, Mr. Daniel"
0,8.05,0,-999.0,3,0,0,0,1,0,0,0,0,0,0,0,0,0,1,0,0,1,0,"Shorney, Mr. Charles Joseph"
0,34.6542,0,71.0,1,0,0,0,1,0,1,0,0,0,0,0,0,0,0,1,0,0,0,"Goldschmidt, Mr. George B"
1,63.3583,1,23.0,1,0,1,0,1,0,0,0,0,1,0,0,0,0,0,1,0,0,0,"Greenfield, Mr. William Bertram"
1,23.0,1,34.0,2,0,1,1,0,0,0,0,0,0,0,0,0,0,1,0,0,1,0,"Doling, Mrs. John T (Ada Julia Bone)"
0,26.0,1,34.0,2,1,0,0,1,0,0,0,0,0,0,0,0,0,1,0,0,1,0,"Kantor, Mr. Sinai"
0,7.8958,0,28.0,3,0,0,1,0,0,0,0,0,0,0,0,0,0,1,0,0,1,0,"Petranec, Miss. Matilda"
0,8.6542,0,33.0,3,0,0,0,1,0,0,0,0,0,0,0,0,0,1,0,0,1,0,"Johansson, Mr. Gustaf Joel"
0,7.925,2,37.0,3,2,0,0,1,0,0,0,0,0,0,0,0,0,1,0,0,1,0,"Gustafsson, Mr. Anders Vilhelm"
0,7.8958,0,28.0,3,0,0,0,1,0,0,0,0,0,0,0,0,0,1,0,0,1,0,"Mionoff, Mr. Stoytcho"
1,7.65,0,21.0,3,0,0,1,0,0,0,0,0,0,0,0,0,0,1,0,0,1,0,"Salkjelsvik, Miss. Anna Kristine"
1,7.775,0,-999.0,3,0,0,0,1,0,0,0,0,0,0,0,0,0,1,0,0,1,0,"Moss, Mr. Albert Johan"
0,52.0,0,47.0,1,0,0,0,1,0,0,0,1,0,0,0,0,0,0,0,0,1,0,"Porter, Mr. Walter Chamberlain"
0,14.4542,1,14.5,3,1,0,1,0,0,0,0,0,0,0,0,0,0,1,1,0,0,0,"Zabour, Miss. Hileni"
0,14.4583,0,17.0,3,0,0,1,0,0,0,0,0,0,0,0,0,0,1,1,0,0,0,"Attalah, Miss. Malake"
0,7.75,0,70.5,3,0,0,0,1,0,0,0,0,0,0,0,0,0,1,0,1,0,0,"Connors, Mr. Patrick"
0,247.5208,1,24.0,1,0,1,0,1,0,0,1,0,0,0,0,0,0,0,1,0,0,0,"Baxter, Mr. Quigg Edmond"
0,31.275,6,2.0,3,4,2,1,0,0,0,0,0,0,0,0,0,0,1,0,0,1,0,"Andersson, Miss. Ellis Anna Maria"
0,73.5,2,21.0,2,2,0,0,1,0,0,0,0,0,0,0,0,0,1,0,0,1,0,"Hickman, Mr. Stanley George"
0,30.0708,1,32.5,2,1,0,0,1,0,0,0,0,0,0,0,0,0,1,1,0,0,0,"Nasser, Mr. Nicholas"
1,13.0,0,32.5,2,0,0,1,0,0,0,0,0,0,1,0,0,0,0,0,0,1,0,"Webber, Miss. Susan"
0,77.2875,1,54.0,1,0,1,0,1,0,0,0,0,1,0,0,0,0,0,0,0,1,0,"White, Mr. Percival Wayland"
1,11.2417,1,12.0,3,1,0,0,1,0,0,0,0,0,0,0,0,0,1,1,0,0,0,"Nicola-Yarred, Master. Elias"
0,7.75,0,-999.0,3,0,0,0,1,0,0,0,0,0,0,0,0,0,1,0,1,0,0,"McMahon, Mr. Martin"
1,7.1417,0,24.0,3,0,0,0,1,0,0,0,0,0,0,0,0,0,1,0,0,1,0,"Madsen, Mr. Fridtjof Arne"
1,22.3583,2,-999.0,3,1,1,1,0,0,0,0,0,0,0,1,0,0,0,1,0,0,0,"Peter, Miss. Anna"
0,6.975,0,45.0,3,0,0,0,1,0,0,0,0,0,0,0,0,0,1,0,0,1,0,"Ekstrom, Mr. Johan"
0,7.8958,0,33.0,3,0,0,0,1,0,0,0,0,0,0,0,0,0,1,1,0,0,0,"Drazenoic, Mr. Jozef"
0,7.05,0,20.0,3,0,0,0,1,0,0,0,0,0,0,0,0,0,1,0,0,1,0,"Coelho, Mr. Domingos Fernandeo"
0,14.5,1,47.0,3,1,0,1,0,0,0,0,0,0,0,0,0,0,1,0,0,1,0,"Robins, Mrs. Alexander A (Grace Charity Laury)"
1,26.0,1,29.0,2,1,0,1,0,0,0,0,0,0,0,0,0,0,1,0,0,1,0,"Weisz, Mrs. Leopold (Mathilde Francoise Pede)"
0,13.0,0,25.0,2,0,0,0,1,0,0,0,0,0,0,0,0,0,1,0,0,1,0,"Sobey, Mr. Samuel James Hayden"
0,15.0458,0,23.0,2,0,0,0,1,0,0,0,0,0,0,0,0,0,1,1,0,0,0,"Richard, Mr. Emile"
1,26.2833,2,19.0,1,0,2,1,0,0,0,0,0,1,0,0,0,0,0,0,0,1,0,"Newsom, Miss. Helen Monypeny"
0,53.1,1,37.0,1,1,0,0,1,0,0,0,1,0,0,0,0,0,0,0,0,1,0,"Futrelle, Mr. Jacques Heath"
0,79.2,0,24.0,1,0,0,0,1,0,0,1,0,0,0,0,0,0,0,1,0,0,0,"Giglio, Mr. Victor"
0,15.2458,2,-999.0,3,0,2,1,0,0,0,0,0,0,0,0,0,0,1,1,0,0,0,"Boulos, Mrs. Joseph (Sultana)"
1,7.75,0,22.0,3,0,0,1,0,0,0,0,0,0,0,0,0,0,1,0,0,1,0,"Nysten, Miss. Anna Sofia"
1,15.85,1,24.0,3,1,0,1,0,0,0,0,0,0,0,0,0,0,1,0,0,1,0,"Hakkarainen, Mrs. Pekka Pietari (Elin Matilda Dolck)"
0,6.75,0,19.0,3,0,0,0,1,0,0,0,0,0,0,0,0,0,1,0,1,0,0,"Burke, Mr. Jeremiah"
0,11.5,0,18.0,2,0,0,0,1,0,0,0,0,0,0,0,0,0,1,0,0,1,0,"Andrew, Mr. Edgardo Samuel"
0,36.75,2,19.0,2,1,1,0,1,0,0,0,0,0,0,0,0,0,1,0,0,1,0,"Nicholls, Mr. Joseph Charles"
1,7.7958,0,27.0,3,0,0,0,1,0,0,0,0,0,0,0,0,0,1,0,0,1,0,"Andersson, Mr. August Edvard (""Wennerstrom"")"
0,13.0,0,42.0,2,0,0,0,1,0,0,0,0,0,0,0,0,0,1,0,0,1,0,"Byles, Rev. Thomas Roussel Davids"
1,66.6,1,22.0,1,1,0,1,0,0,0,0,1,0,0,0,0,0,0,0,0,1,0,"Pears, Mrs. Thomas (Edith Wearne)"
0,14.5,2,40.5,3,0,2,0,1,0,0,0,0,0,0,0,0,0,1,0,0,1,0,"van Billiard, Mr. Austin Blyler"
0,7.3125,0,-999.0,3,0,0,0,1,0,0,0,0,0,0,0,0,0,1,0,0,1,0,"Olsen, Mr. Ole Martin"
0,61.3792,1,51.0,1,0,1,0,1,0,0,0,0,0,0,0,0,0,1,1,0,0,0,"Williams, Mr. Charles Duane"
1,7.7333,0,16.0,3,0,0,1,0,0,0,0,0,0,0,0,0,0,1,0,1,0,0,"Gilnagh, Miss. Katherine ""Katie"""
0,8.05,0,30.0,3,0,0,0,1,0,0,0,0,0,0,0,0,0,1,0,0,1,0,"Corn, Mr. Harry"
0,8.6625,0,-999.0,3,0,0,0,1,0,0,0,0,0,0,0,0,0,1,0,0,1,0,"Smiljanic, Mr. Mile"
0,69.55,10,-999.0,3,8,2,0,1,0,0,0,0,0,0,0,0,0,1,0,0,1,0,"Sage, Master. Thomas Henry"
1,15.75,0,40.0,2,0,0,1,0,0,0,0,0,0,0,0,0,0,1,0,0,1,0,"Watt, Mrs. James (Elizabeth ""Bessie"" Inglis Milne)"
0,7.775,0,26.0,3,0,0,0,1,0,0,0,0,0,0,0,0,0,1,0,0,1,0,"Bengtsson, Mr. John Viktor"
0,8.6625,0,17.0,3,0,0,0,1,0,0,0,0,0,0,0,0,0,1,0,0,1,0,"Calic, Mr. Jovo"
0,39.6875,5,1.0,3,4,1,0,1,0,0,0,0,0,0,0,0,0,1,0,0,1,0,"Panula, Master. Eino Viljami"
1,20.525,2,9.0,3,0,2,0,1,0,0,0,0,0,0,0,0,0,1,0,0,1,0,"Goldsmith, Master. Frank John William ""Frankie"""
0,27.9,5,45.0,3,1,4,1,0,0,0,0,0,0,0,0,0,0,1,0,0,1,0,"Skoog, Mrs. William (Anna Bernhardina Karlsson)"
0,25.925,0,-999.0,1,0,0,0,1,0,0,0,0,0,0,0,0,0,1,0,0,1,0,"Baumann, Mr. John D"
0,56.4958,0,28.0,3,0,0,0,1,0,0,0,0,0,0,0,0,0,1,0,0,1,0,"Ling, Mr. Lee"
0,29.125,5,4.0,3,4,1,0,1,0,0,0,0,0,0,0,0,0,1,0,1,0,0,"Rice, Master. Arthur"
1,11.1333,2,1.0,3,1,1,1,0,0,0,0,0,0,0,0,0,0,1,0,0,1,0,"Johnson, Miss. Eleanor Ileen"
0,30.6958,0,56.0,1,0,0,0,1,0,1,0,0,0,0,0,0,0,0,1,0,0,0,"Smith, Mr. James Clinch"
0,25.4667,4,-999.0,3,3,1,0,1,0,0,0,0,0,0,0,0,0,1,0,0,1,0,"Lefebre, Master. Henry Forbes"
0,28.7125,0,50.0,1,0,0,1,0,0,0,0,1,0,0,0,0,0,0,1,0,0,0,"Isham, Miss. Ann Elizabeth"
0,13.0,0,30.0,2,0,0,0,1,0,0,0,0,0,0,0,0,0,1,0,0,1,0,"Hale, Mr. Reginald"
0,0.0,0,36.0,3,0,0,0,1,0,0,0,0,0,0,0,0,0,1,0,0,1,0,"Leonard, Mr. Lionel"
0,69.55,10,-999.0,3,8,2,1,0,0,0,0,0,0,0,0,0,0,1,0,0,1,0,"Sage, Miss. Constance Gladys"
0,15.05,0,-999.0,2,0,0,0,1,0,0,0,0,0,0,0,0,0,1,1,0,0,0,"Pernot, Mr. Rene"
0,31.3875,6,9.0,3,4,2,0,1,0,0,0,0,0,0,0,0,0,1,0,0,1,0,"Asplund, Master. Clarence Gustaf Hugo"
1,39.0,3,1.0,2,2,1,0,1,0,0,0,0,0,0,1,0,0,0,0,0,1,0,"Becker, Master. Richard F"
1,22.025,2,4.0,3,0,2,1,0,0,0,0,0,0,0,0,0,0,1,0,0,1,0,"Kink-Heilmann, Miss. Luise Gretchen"
1,15.5,1,-999.0,3,1,0,1,0,0,0,0,0,0,0,0,0,0,1,0,1,0,0,"O'Brien, Mrs. Thomas (Johanna ""Hannah"" Godfrey)"
1,26.55,0,45.0,1,0,0,0,1,0,0,0,0,0,0,0,0,0,1,0,0,1,0,"Romaine, Mr. Charles Hallace (""Mr C Rolmane"")"
0,15.5,2,40.0,3,1,1,0,1,0,0,0,0,0,0,0,0,0,1,0,1,0,0,"Bourke, Mr. John"
0,7.8958,0,36.0,3,0,0,0,1,0,0,0,0,0,0,0,0,0,1,0,0,1,0,"Turcin, Mr. Stjepan"
1,13.0,0,32.0,2,0,0,1,0,0,0,0,0,0,0,0,0,0,1,0,0,1,0,"Pinsky, Mrs. (Rosa)"
0,13.0,0,19.0,2,0,0,0,1,0,0,0,0,0,0,0,0,0,1,0,0,1,0,"Carbines, Mr. William"
1,26.0,2,3.0,2,1,1,0,1,0,0,0,0,0,0,1,0,0,0,0,0,1,0,"Navratil, Master. Michel M"
1,146.5208,0,58.0,1,0,0,1,0,0,0,1,0,0,0,0,0,0,0,1,0,0,0,"Lurette, Miss. Elise"
0,7.75,0,-999.0,3,0,0,0,1,0,0,0,0,0,0,0,0,0,1,0,1,0,0,"Mernagh, Mr. Robert"
0,8.4042,1,42.0,3,0,1,0,1,0,0,0,0,0,0,0,0,0,1,0,0,1,0,"Olsen, Mr. Karl Siegwart Andreas"
1,7.75,0,-999.0,3,0,0,1,0,0,0,0,0,0,0,0,0,0,1,0,1,0,0,"Madigan, Miss. Margaret ""Maggie"""
0,13.0,0,24.0,2,0,0,1,0,0,0,0,0,0,0,0,0,0,1,0,0,1,0,"Yrois, Miss. Henriette (""Mrs Harbeck"")"
0,69.55,10,-999.0,3,8,2,0,1,0,0,0,0,0,0,0,0,0,1,0,0,1,0,"Sage, Mr. Frederick"
0,6.4958,0,34.0,3,0,0,0,1,0,0,0,0,0,0,0,0,0,1,0,0,1,0,"Johanson, Mr. Jakob Alfred"
0,7.225,0,45.5,3,0,0,0,1,0,0,0,0,0,0,0,0,0,1,1,0,0,0,"Youseff, Mr. Gerious"
1,8.05,0,18.0,3,0,0,0,1,0,0,0,0,0,0,0,0,0,1,0,0,1,0,"Cohen, Mr. Gurshon ""Gus"""
0,10.4625,1,2.0,3,0,1,1,0,0,0,0,0,0,0,0,1,0,0,0,0,1,0,"Strom, Miss. Telma Matilda"
1,18.7875,0,26.0,3,0,0,0,1,0,0,0,0,0,0,0,0,0,1,1,0,0,0,"Albimona, Mr. Nassef Cassem"
1,7.75,0,16.0,3,0,0,1,0,0,0,0,0,0,0,0,0,0,1,0,1,0,0,"Carr, Miss. Helen ""Ellen"""
1,21.0,0,35.0,2,0,0,1,0,0,0,0,0,0,0,0,0,0,1,0,0,1,0,"Cameron, Miss. Clear Annie"
0,7.25,0,22.0,3,0,0,0,1,0,0,0,0,0,0,0,0,0,1,0,0,1,0,"Perkin, Mr. John Henry"
0,13.0,0,30.0,2,0,0,0,1,0,0,0,0,0,0,0,0,0,1,0,0,1,0,"Givard, Mr. Hans Kristensen"
0,7.75,1,-999.0,3,1,0,0,1,0,0,0,0,0,0,0,0,0,1,0,1,0,0,"Kiernan, Mr. Philip"
1,113.275,1,31.0,1,1,0,1,0,0,0,0,0,1,0,0,0,0,0,1,0,0,0,"Newell, Miss. Madeleine"
1,7.925,0,27.0,3,0,0,1,0,0,0,0,0,0,0,0,0,0,1,0,0,1,0,"Honkanen, Miss. Eliina"
0,27.0,1,42.0,2,1,0,0,1,0,0,0,0,0,0,0,0,0,1,0,0,1,0,"Jacobsohn, Mr. Sidney Samuel"
1,76.2917,0,32.0,1,0,0,1,0,0,0,0,0,1,0,0,0,0,0,1,0,0,0,"Bazzani, Miss. Albina"
0,10.5,0,30.0,2,0,0,0,1,0,0,0,0,0,0,0,0,0,1,0,0,1,0,"Harris, Mr. Walter"
1,8.05,0,16.0,3,0,0,0,1,0,0,0,0,0,0,0,0,0,1,0,0,1,0,"Sunderland, Mr. Victor Francis"
0,13.0,0,27.0,2,0,0,0,1,0,0,0,0,0,0,0,0,0,1,0,0,1,0,"Bracken, Mr. James H"
1,90.0,1,38.0,1,1,0,0,1,0,0,0,1,0,0,0,0,0,0,0,0,1,0,"Hoyt, Mr. Frederick Maxfield"
0,9.35,0,22.0,3,0,0,0,1,0,0,0,0,0,0,0,0,0,1,0,0,1,0,"Berglund, Mr. Karl Ivar Sven"
1,10.5,0,19.0,2,0,0,0,1,0,0,0,0,0,0,0,0,0,1,0,0,1,0,"Mellors, Mr. William John"
0,7.25,0,20.5,3,0,0,0,1,0,0,0,0,0,0,0,0,0,1,0,0,1,0,"Lovell, Mr. John Hall (""Henry"")"
0,13.0,0,18.0,2,0,0,0,1,0,0,0,0,0,0,0,0,0,1,0,0,1,0,"Fahlstrom, Mr. Arne Jonas"
0,25.4667,4,-999.0,3,3,1,1,0,0,0,0,0,0,0,0,0,0,1,0,0,1,0,"Lefebre, Miss. Mathilde"
1,83.475,1,35.0,1,1,0,1,0,0,0,0,1,0,0,0,0,0,0,0,0,1,0,"Harris, Mrs. Henry Birkhardt (Irene Wallach)"
0,7.775,0,29.0,3,0,0,0,1,0,0,0,0,0,0,0,0,0,1,0,0,1,0,"Larsson, Mr. Bengt Edvin"
0,13.5,0,59.0,2,0,0,0,1,0,0,0,0,0,0,0,0,0,1,0,0,1,0,"Sjostedt, Mr. Ernst Adolf"
0,10.5,0,24.0,2,0,0,0,1,0,0,0,0,0,0,0,0,0,1,0,0,1,0,"Leyson, Mr. Robert William Norman"
0,26.0,1,44.0,2,1,0,0,1,0,0,0,0,0,0,0,0,0,1,0,0,1,0,"Hold, Mr. Stephen"
1,26.25,2,8.0,2,0,2,1,0,0,0,0,0,0,0,0,0,0,1,0,0,1,0,"Collyer, Miss. Marjorie ""Lottie"""
0,10.5,0,19.0,2,0,0,0,1,0,0,0,0,0,0,0,0,0,1,0,0,1,0,"Pengelly, Mr. Frederick William"
0,14.4542,1,-999.0,3,1,0,1,0,0,0,0,0,0,0,0,0,0,1,1,0,0,0,"Zabour, Miss. Thamine"
1,15.5,1,-999.0,3,1,0,1,0,0,0,0,0,0,0,0,0,0,1,0,1,0,0,"Murphy, Miss. Katherine ""Kate"""
0,10.5,0,29.0,2,0,0,0,1,0,0,0,0,0,0,0,0,0,1,0,0,1,0,"Coleridge, Mr. Reginald Charles"
0,7.125,0,22.0,3,0,0,0,1,0,0,0,0,0,0,0,0,0,1,0,0,1,0,"Maenpaa, Mr. Matti Alexanteri"
0,7.225,0,30.0,3,0,0,0,1,0,0,0,0,0,0,0,0,0,1,1,0,0,0,"Attalah, Mr. Sleiman"
0,90.0,2,44.0,1,2,0,0,1,0,0,0,1,0,0,0,0,0,0,0,1,0,0,"Minahan, Dr. William Edward"
0,7.775,0,25.0,3,0,0,1,0,0,0,0,0,0,0,0,0,0,1,0,0,1,0,"Lindahl, Miss. Agda Thorilda Viktoria"
1,14.5,2,24.0,2,0,2,1,0,0,0,0,0,0,0,0,0,0,1,0,0,1,0,"Hamalainen, Mrs. William (Anna)"
1,52.5542,2,37.0,1,1,1,0,1,0,0,0,0,1,0,0,0,0,0,0,0,1,0,"Beckwith, Mr. Richard Leonard"
0,26.0,1,54.0,2,1,0,0,1,0,0,0,0,0,0,0,0,0,1,0,0,1,0,"Carter, Rev. Ernest Courtenay"
0,10.4625,2,29.0,3,1,1,1,0,0,0,0,0,0,0,0,1,0,0,0,0,1,0,"Strom, Mrs. Wilhelm (Elna Matilda Persson)"
0,16.1,1,30.0,3,1,0,0,1,0,0,0,0,0,0,0,0,0,1,0,0,1,0,"Lobb, Mr. William Arthur"
0,20.2125,2,41.0,3,0,2,1,0,0,0,0,0,0,0,0,0,0,1,0,0,1,0,"Rosblom, Mrs. Viktor (Helena Wilhelmina)"
1,15.2458,2,29.0,3,0,2,1,0,0,0,0,0,0,0,0,0,0,1,1,0,0,0,"Touma, Mrs. Darwis (Hanne Youssef Razi)"
1,86.5,0,30.0,1,0,0,1,0,0,0,1,0,0,0,0,0,0,0,0,0,1,0,"Cherry, Miss. Gladys"
1,512.3292,0,35.0,1,0,0,1,0,0,0,0,0,0,0,0,0,0,1,1,0,0,0,"Ward, Miss. Anna"
0,79.65,2,52.0,1,1,1,0,1,0,0,0,0,0,1,0,0,0,0,0,0,1,0,"Taussig, Mr. Emil"
0,0.0,0,40.0,1,0,0,0,1,0,0,1,0,0,0,0,0,0,0,0,0,1,0,"Harrison, Mr. William"
0,7.75,0,-999.0,3,0,0,1,0,0,0,0,0,0,0,0,0,0,1,0,1,0,0,"Henry, Miss. Delia"
0,10.5,0,36.0,2,0,0,0,1,0,0,0,0,0,0,0,0,0,1,0,0,1,0,"Reeves, Mr. David"
0,39.6875,5,16.0,3,4,1,0,1,0,0,0,0,0,0,0,0,0,1,0,0,1,0,"Panula, Mr. Ernesti Arvid"
1,7.775,1,25.0,3,1,0,0,1,0,0,0,0,0,0,0,0,0,1,0,0,1,0,"Persson, Mr. Ernst Ulrik"
1,153.4625,1,58.0,1,0,1,1,0,0,0,0,1,0,0,0,0,0,0,0,0,1,0,"Graham, Mrs. William Thompson (Edith Junkins)"
1,135.6333,0,35.0,1,0,0,1,0,0,0,0,1,0,0,0,0,0,0,0,0,1,0,"Bissette, Miss. Amelia"
0,31.0,0,-999.0,1,0,0,0,1,0,0,0,0,0,0,0,0,0,1,0,0,1,0,"Cairns, Mr. Alexander"
1,0.0,0,25.0,3,0,0,0,1,0,0,0,0,0,0,0,0,0,1,0,0,1,0,"Tornquist, Mr. William Henry"
1,19.5,1,41.0,2,0,1,1,0,0,0,0,0,0,0,0,0,0,1,0,0,1,0,"Mellinger, Mrs. (Elizabeth Anne Maidment)"
0,29.7,1,37.0,1,0,1,0,1,0,0,0,1,0,0,0,0,0,0,1,0,0,0,"Natsch, Mr. Charles H"
0,7.75,0,45.0,3,0,0,1,0,0,0,0,0,0,0,0,0,0,1,0,0,1,0,"Lindblom, Miss. Augusta Charlotta"
0,0.0,0,-999.0,2,0,0,0,1,0,0,0,0,0,0,0,0,0,1,0,0,1,0,"Parkes, Mr. Francis ""Frank"""
0,29.125,5,7.0,3,4,1,0,1,0,0,0,0,0,0,0,0,0,1,0,1,0,0,"Rice, Master. Eric"
0,7.75,0,65.0,3,0,0,0,1,0,0,0,0,0,0,0,0,0,1,0,1,0,0,"Duane, Mr. Frank"
0,7.8542,0,28.0,3,0,0,0,1,0,0,0,0,0,0,0,0,0,1,0,0,1,0,"Olsson, Mr. Nils Johan Goransson"
0,9.5,0,16.0,3,0,0,0,1,0,0,0,0,0,0,0,0,0,1,0,0,1,0,"de Pelsmaeker, Mr. Alfons"
1,8.05,0,19.0,3,0,0,0,1,0,0,0,0,0,0,0,0,0,1,0,0,1,0,"Dorking, Mr. Edward Arthur"
0,8.6625,0,33.0,3,0,0,0,1,0,0,0,0,0,0,0,0,0,1,1,0,0,0,"Stankovic, Mr. Ivan"
1,9.5,0,30.0,3,0,0,0,1,0,0,0,0,0,0,0,0,0,1,0,0,1,0,"de Mulder, Mr. Theodore"
0,7.8958,0,22.0,3,0,0,0,1,0,0,0,0,0,0,0,0,0,1,0,0,1,0,"Naidenoff, Mr. Penko"
1,13.0,0,42.0,2,0,0,0,1,0,0,0,0,0,0,0,0,0,1,0,0,1,0,"Hosono, Mr. Masabumi"
1,78.85,0,26.0,1,0,0,1,0,0,0,0,0,0,0,0,0,0,1,0,0,1,0,"Barber, Miss. Ellen ""Nellie"""
0,8.85,0,24.0,3,0,0,1,0,0,0,0,0,0,0,0,0,0,1,0,0,1,0,"Haas, Miss. Aloisia"
0,7.8958,0,24.0,3,0,0,0,1,0,0,0,0,0,0,0,0,0,1,0,0,1,0,"Mineff, Mr. Ivan"
0,7.2292,0,23.5,3,0,0,0,1,0,0,0,0,0,0,0,0,0,1,1,0,0,0,"Hanna, Mr. Mansour"
0,151.55,3,2.0,1,1,2,1,0,0,0,0,1,0,0,0,0,0,0,0,0,1,0,"Allison, Miss. Helen Loraine"
1,30.5,0,-999.0,1,0,0,0,1,0,0,0,1,0,0,0,0,0,0,0,0,1,0,"Saalfeld, Mr. Adolphe"
1,247.5208,1,50.0,1,0,1,1,0,0,0,1,0,0,0,0,0,0,0,1,0,0,0,"Baxter, Mrs. James (Helene DeLaudeniere Chaput)"
1,7.75,0,-999.0,3,0,0,1,0,0,0,0,0,0,0,0,0,0,1,0,1,0,0,"Kelly, Miss. Anna Katherine ""Annie Kate"""
1,23.25,2,-999.0,3,2,0,0,1,0,0,0,0,0,0,0,0,0,1,0,1,0,0,"McCoy, Mr. Bernard"
0,0.0,0,19.0,3,0,0,0,1,0,0,0,0,0,0,0,0,0,1,0,0,1,0,"Johnson, Mr. William Cahoone Jr"
1,12.35,0,-999.0,2,0,0,1,0,0,0,0,0,0,1,0,0,0,0,0,1,0,0,"Keane, Miss. Nora A"
1,151.55,3,0.92,1,1,2,0,1,0,0,0,1,0,0,0,0,0,0,0,0,1,0,"Allison, Master. Hudson Trevor"
1,110.8833,0,-999.0,1,0,0,1,0,0,0,0,0,0,0,0,0,0,1,1,0,0,0,"Fleming, Miss. Margaret"
1,108.9,1,17.0,1,1,0,1,0,0,0,0,1,0,0,0,0,0,0,1,0,0,0,"Penasco y Castellana, Mrs. Victor de Satode (Maria Josefa Perez de Soto y Vallejo)"
0,24.0,1,30.0,2,1,0,0,1,0,0,0,0,0,0,0,0,0,1,1,0,0,0,"Abelson, Mr. Samuel"
1,56.9292,0,30.0,1,0,0,1,0,0,0,0,0,0,1,0,0,0,0,1,0,0,0,"Francatelli, Miss. Laura Mabel"
1,83.1583,0,24.0,1,0,0,1,0,0,0,0,1,0,0,0,0,0,0,1,0,0,0,"Hays, Miss. Margaret Bechstein"
1,262.375,4,18.0,1,2,2,1,0,0,0,1,0,0,0,0,0,0,0,1,0,0,0,"Ryerson, Miss. Emily Borie"
0,26.0,2,26.0,2,1,1,1,0,0,0,0,0,0,0,0,0,0,1,0,0,1,0,"Lahtinen, Mrs. William (Anna Sylfven)"
0,7.8958,0,28.0,3,0,0,0,1,0,0,0,0,0,0,0,0,0,1,0,0,1,0,"Hendekovic, Mr. Ignjac"
0,26.25,2,43.0,2,1,1,0,1,0,0,0,0,0,0,0,0,0,1,0,0,1,0,"Hart, Mr. Benjamin"
1,7.8542,0,26.0,3,0,0,1,0,0,0,0,0,0,0,0,0,0,1,0,0,1,0,"Nilsson, Miss. Helmina Josefina"
1,26.0,1,24.0,2,1,0,1,0,0,0,0,0,0,0,0,0,0,1,0,0,1,0,"Kantor, Mrs. Sinai (Miriam Sternin)"
0,14.0,0,54.0,2,0,0,0,1,0,0,0,0,0,0,0,0,0,1,0,0,1,0,"Moraweck, Dr. Ernest"
1,164.8667,2,31.0,1,0,2,1,0,0,0,0,1,0,0,0,0,0,0,0,0,1,0,"Wick, Miss. Mary Natalie"
1,134.5,2,40.0,1,1,1,1,0,0,0,0,0,0,1,0,0,0,0,1,0,0,0,"Spedden, Mrs. Frederic Oakley (Margaretta Corning Stone)"
0,7.25,0,22.0,3,0,0,0,1,0,0,0,0,0,0,0,0,0,1,0,0,1,0,"Dennis, Mr. Samuel"
0,7.8958,0,27.0,3,0,0,0,1,0,0,0,0,0,0,0,0,0,1,0,0,1,0,"Danoff, Mr. Yoto"
1,12.35,0,30.0,2,0,0,1,0,0,0,0,0,0,0,0,0,0,1,0,1,0,0,"Slayter, Miss. Hilda Mary"
1,29.0,2,22.0,2,1,1,1,0,0,0,0,0,0,0,0,0,0,1,0,0,1,0,"Caldwell, Mrs. Albert Francis (Sylvia Mae Harbaugh)"
1,135.6333,0,36.0,1,0,0,1,0,0,0,0,1,0,0,0,0,0,0,1,0,0,0,"Young, Miss. Marie Grice"
1,13.0,0,36.0,2,0,0,1,0,0,0,0,0,1,0,0,0,0,0,0,0,1,0,"Ball, Mrs. (Ada E Hall)"
1,20.525,2,31.0,3,1,1,1,0,0,0,0,0,0,0,0,0,0,1,0,0,1,0,"Goldsmith, Mrs. Frank John (Emily Alice Brown)"
1,57.9792,1,16.0,1,0,1,1,0,0,0,1,0,0,0,0,0,0,0,1,0,0,0,"Hippach, Miss. Jean Gertrude"
1,23.25,2,-999.0,3,2,0,1,0,0,0,0,0,0,0,0,0,0,1,0,1,0,0,"McCoy, Miss. Agnes"
0,28.5,0,45.5,1,0,0,0,1,0,0,0,1,0,0,0,0,0,0,0,0,1,0,"Partner, Mr. Austen"
0,153.4625,1,38.0,1,0,1,0,1,0,0,0,1,0,0,0,0,0,0,0,0,1,0,"Graham, Mr. George Edward"
0,18.0,2,16.0,3,2,0,0,1,0,0,0,0,0,0,0,0,0,1,0,0,1,0,"Vander Planke, Mr. Leo Edmondus"
0,66.6,1,29.0,1,1,0,0,1,0,0,0,1,0,0,0,0,0,0,0,0,1,0,"Pears, Mr. Thomas Clinton"
1,8.05,0,45.0,3,0,0,0,1,0,0,0,0,0,0,0,0,0,1,0,0,1,0,"Dahl, Mr. Karl Edwart"
0,35.5,0,45.0,1,0,0,0,1,0,0,0,0,0,0,0,0,1,0,0,0,1,0,"Blackwell, Mr. Stephen Weart"
1,26.0,2,2.0,2,1,1,0,1,0,0,0,0,0,0,1,0,0,0,0,0,1,0,"Navratil, Master. Edmond Roger"
1,263.0,5,24.0,1,3,2,1,0,0,0,0,1,0,0,0,0,0,0,0,0,1,0,"Fortune, Miss. Alice Elizabeth"
0,13.0,0,28.0,2,0,0,0,1,0,0,0,0,0,0,0,0,0,1,0,0,1,0,"Collander, Mr. Erik Gustaf"
0,13.0,0,25.0,2,0,0,0,1,0,0,0,0,0,0,0,0,0,1,0,0,1,0,"Sedgwick, Mr. Charles Frederick Waddington"
0,13.0,0,36.0,2,0,0,0,1,0,0,0,0,0,0,0,0,0,1,0,0,1,0,"Fox, Mr. Stanley Hubert"
1,13.0,0,24.0,2,0,0,1,0,0,0,0,0,0,0,1,0,0,0,0,0,1,0,"Brown, Miss. Amelia ""Mildred"""
1,13.0,0,40.0,2,0,0,1,0,0,0,0,0,0,0,0,0,0,1,0,0,1,0,"Smith, Miss. Marion Elsie"
1,16.1,1,-999.0,3,1,0,1,0,0,0,0,0,0,0,0,0,0,1,0,0,1,0,"Davison, Mrs. Thomas Henry (Mary E Finck)"
1,15.9,2,3.0,3,1,1,0,1,0,0,0,0,0,0,0,0,0,1,0,0,1,0,"Coutts, Master. William Loch ""William"""
0,9.225,0,23.0,3,0,0,0,1,0,0,0,0,0,0,0,0,0,1,0,0,1,0,"Odahl, Mr. Nils Martin"
0,35.0,0,-999.0,1,0,0,0,1,0,0,0,1,0,0,0,0,0,0,0,0,1,0,"Williams-Lambert, Mr. Fletcher Fellows"
0,7.2292,2,15.0,3,1,1,0,1,0,0,0,0,0,0,0,0,0,1,1,0,0,0,"Elias, Mr. Tannous"
0,17.8,1,25.0,3,1,0,0,1,0,0,0,0,0,0,0,0,0,1,0,0,1,0,"Arnold-Franchi, Mr. Josef"
0,7.225,0,-999.0,3,0,0,0,1,0,0,0,0,0,0,0,0,0,1,1,0,0,0,"Yousif, Mr. Wazli"
0,9.5,0,28.0,3,0,0,0,1,0,0,0,0,0,0,0,0,0,1,0,0,1,0,"Vanden Steen, Mr. Leo Peter"
1,55.0,1,22.0,1,0,1,1,0,0,0,0,0,0,1,0,0,0,0,0,0,1,0,"Bowerman, Miss. Elsie Edith"
0,13.0,0,38.0,2,0,0,1,0,0,0,0,0,0,0,0,0,0,1,0,0,1,0,"Funk, Miss. Annie Clemmer"
1,7.8792,0,-999.0,3,0,0,1,0,0,0,0,0,0,0,0,0,0,1,0,1,0,0,"McGovern, Miss. Mary"
1,7.8792,0,-999.0,3,0,0,1,0,0,0,0,0,0,0,0,0,0,1,0,1,0,0,"Mockler, Miss. Helen Mary ""Ellie"""
0,27.9,5,40.0,3,1,4,0,1,0,0,0,0,0,0,0,0,0,1,0,0,1,0,"Skoog, Mr. Wilhelm"
0,14.4542,1,45.0,3,0,1,1,0,0,0,0,0,0,0,0,0,0,1,1,0,0,0,"Barbara, Mrs. (Catherine David)"
0,7.05,0,35.0,3,0,0,0,1,0,0,0,0,0,0,0,0,0,1,0,0,1,0,"Asim, Mr. Adola"
0,15.5,1,-999.0,3,1,0,0,1,0,0,0,0,0,0,0,0,0,1,0,1,0,0,"O'Brien, Mr. Thomas"
0,7.25,0,30.0,3,0,0,0,1,0,0,0,0,0,0,0,0,0,1,0,0,1,0,"Adahl, Mr. Mauritz Nils Martin"
1,75.25,1,60.0,1,1,0,1,0,0,0,0,0,1,0,0,0,0,0,1,0,0,0,"Warren, Mrs. Frank Manley (Anna Sophia Atkinson)"
1,7.2292,0,-999.0,3,0,0,1,0,0,0,0,0,0,0,0,0,0,1,1,0,0,0,"Moussa, Mrs. (Mantoura Boulos)"
1,7.75,0,-999.0,3,0,0,1,0,0,0,0,0,0,0,0,0,0,1,0,1,0,0,"Jermyn, Miss. Annie"
1,69.3,0,24.0,1,0,0,1,0,0,0,1,0,0,0,0,0,0,0,1,0,0,0,"Aubart, Mme. Leontine Pauline"
1,55.4417,1,25.0,1,1,0,0,1,0,0,0,0,0,1,0,0,0,0,1,0,0,0,"Harder, Mr. George Achilles"
0,6.4958,1,18.0,3,1,0,0,1,0,0,0,0,0,0,0,0,0,1,0,0,1,0,"Wiklund, Mr. Jakob Alfred"
0,135.6333,0,22.0,1,0,0,0,1,0,0,0,0,0,0,0,0,0,1,1,0,0,0,"Ringhini, Mr. Sante"
0,21.075,4,3.0,3,3,1,1,0,0,0,0,0,0,0,0,0,0,1,0,0,1,0,"Palsson, Miss. Stina Viola"
1,7.25,0,22.0,3,0,0,1,0,0,0,0,0,0,0,0,0,0,1,0,0,1,0,"Landergren, Miss. Aurora Adelia"
0,4.0125,0,20.0,3,0,0,0,1,0,0,0,0,0,0,0,0,0,1,1,0,0,0,"Betros, Mr. Tannous"
1,227.525,0,42.0,1,0,0,1,0,0,0,0,0,0,0,0,0,0,1,1,0,0,0,"Bidois, Miss. Rosalie"
1,15.7417,2,1.0,3,0,2,1,0,0,0,0,0,0,0,0,0,0,1,1,0,0,0,"Nakid, Miss. Maria (""Mary"")"
0,7.925,0,32.0,3,0,0,0,1,0,0,0,0,0,0,0,0,0,1,0,0,1,0,"Tikkanen, Mr. Juho"
